[
  {
    "id": "puz-1-1-1",
    "category": "logika",
    "subtype": "1.1",
    "categoryTitle": "Logične in analitične uganke",
    "subtypeTitle": "Deduktivne in mrežne uganke",
    "title": "Tekma in mesta na stopničkah",
    "prompt": "Na teku sodelujejo 4 tekmovalci: Alen, Blaž, Bine in David.\n\nZnana so 3 dejstva:\n1. Alen ni bil prvi in ni bil zadnji (4.).\n2. Blaž je ciljno črto prečkal takoj za Binetom.\n3. David ni bil zadnji (4.).\n\nKdo je zmagal na tekmi (1. mesto)?",
    "type": "multiple_choice",
    "options": ["David", "Bine", "Alen", "Blaž"],
    "answer": "David",
    "hints": [
      "Blaž je prispel takoj za Binetom – tvori par (Bine → Blaž).",
      "Alen ni 1. in ni 4., torej je lahko LE 2. ALI 3.",
      "Če sta Bine in Blaž na 3. in 4. mestu, je Alen 2. in David 1."
    ],
    "explanation": "Blaž za Bineim pomeni par (Bine, Blaž) na mestih (3,4), (2,3) ali (1,2). Alen ni 1. niti 4. → Alen je 2. ali 3. David ni 4. → David je 1., 2. ali 3. Edina konsistentna kombinacija: 1. David, 2. Alen, 3. Bine, 4. Blaž."
  },
  {
    "id": "puz-1-1-2",
    "category": "logika",
    "subtype": "1.1",
    "categoryTitle": "Logične in analitične uganke",
    "subtypeTitle": "Deduktivne in mrežne uganke",
    "title": "Dedukcija hiš in poklicev",
    "prompt": "Trije prijatelji (Ana, Boris in Cveto) živijo v treh hišah različnih barv (rdeča, modra, zelena) in imajo tri različne poklice (inženir, zdravnik, arhitekt).\n\nZnana so 4 dejstva:\n1. Arhitekt ne živi v rdeči hiši.\n2. Boris živi v rdeči hiši.\n3. Zdravnik živi v modri hiši.\n4. Ana je arhitektka.\n\nKatero hišo in kateri poklic ima Cveto?",
    "type": "multiple_choice",
    "options": [
      "Modra hiša in zdravnik",
      "Zelena hiša in inženir",
      "Rdeča hiša in zdravnik",
      "Modra hiša in inženir"
    ],
    "answer": "Modra hiša in zdravnik",
    "hints": [
      "Ana je arhitektka (dejstvo 4). Ker arhitekt ne živi v rdeči hiši (dejstvo 1) in ker zdravnik živi v modri hiši (dejstvo 3), Ana živi v zeleni hiši.",
      "Boris živi v rdeči hiši (dejstvo 2) in je po poklicu inženir.",
      "Za Cveta ostane modra hiša in poklic zdravnika (saj zdravnik živi v modri hiši)."
    ],
    "explanation": "Ana je arhitektka v zeleni hiši (ker arhitekt ne živi v rdeči in ne v modri hiši). Boris živi v rdeči hiši in je inženir. Cveto torej živi v modri hiši in ima poklic zdravnika."
  },
  {
    "id": "puz-1-1-3",
    "category": "logika",
    "subtype": "1.1",
    "categoryTitle": "Logične in analitične uganke",
    "subtypeTitle": "Deduktivne in mrežne uganke",
    "title": "Otok resničarjev in lažnivcev",
    "prompt": "Na otoku živita dve vrsti ljudi: resničarji (ki VEDNO govorijo resnico) in lažnivci (ki VEDNO lažejo).\nSrečaš dva otočana, A in B.\nOtočan A izjavi: »Vsaj eden od naju dveh je lažnivec.«\n\nKaj sta A in B?",
    "type": "multiple_choice",
    "options": [
      "A je resničar, B pa je lažnivec",
      "Oba sta resničarja",
      "Oba sta lažnivca",
      "A je lažnivec, B pa resničar"
    ],
    "answer": "A je resničar, B pa je lažnivec",
    "hints": [
      "Predpostavi, da je A lažnivec. Kaj sledi?",
      "Izjava A ('vsaj eden je lažnivec') bi bila v tem primeru RESNIČNA. Ali to lahko drži?",
      "Torej A MORA biti resničar. In njegova izjava drži."
    ],
    "explanation": "Predpostavimo: A = lažnivec. Nato je njegova izjava ('vsaj eden je lažnivec') resnična (ker je A lažnivec). Toda lažnivec ne more povedati resnico → protislovje. Torej A NI lažnivec, je resničar. Ker A govori resnico, drži trditev 'vsaj eden je lažnivec'. Ker A ni lažnivec, MORA biti B lažnivec."
  },
  {
    "id": "puz-1-1-4",
    "category": "logika",
    "subtype": "1.1",
    "categoryTitle": "Logične in analitične uganke",
    "subtypeTitle": "Deduktivne in mrežne uganke",
    "title": "Tri kapuce na glavi",
    "prompt": "Trije modreci sedijo v vrsti. Modrec A vidi modreca B in C. Modrec B vidi le C. Modrec C ne vidi nikogar. Iz vreče s 3 belimi in 2 črnima kapucama jim na glavo posadijo po eno kapuco.\nNa vprašanje, ali ve, katero barvo kapuce ima na glavi, modrec A reče: »Ne vem.«\nNato modrec B reče: »Tudi jaz ne vem.«\nKo sliši njuna odgovora, modrec C reče: »Jaz pa zanesljivo vem, katero barvo kapuce imam!«\n\nKatero barvo kapuce ima modrec C?",
    "type": "multiple_choice",
    "options": [
      "bela kapuca",
      "črna kapuca",
      "Možno je oboje",
      "Z danimi podatki ni mogoče ugotoviti"
    ],
    "answer": "bela kapuca",
    "hints": [
      "A vidi B in C. Če bi imela OBA črno kapuco, bi A takoj vedel, da ima belo (v vreči so le 2 črni). A ne ve → B in C NISTA OBA črna.",
      "B vidi C. B VE, da (B,C) nista oba črna. Če bi C imel črno, bi B vedel, da mora imeti BELO. B pravi 'Ne vem' → C NІMA črne.",
      "Torej C = bela."
    ],
    "explanation": "A ne ve → B in C nista oba črna. B ve to in vidi C. Če bi C imel črno, bi B takoj vedel, da ima sam belo. Ker B ne ve → C nima črne. C deducira: imam belo kapuco."
  },
  {
    "id": "puz-1-2-1",
    "category": "logika",
    "subtype": "1.2",
    "categoryTitle": "Logične in analitične uganke",
    "subtypeTitle": "Prostorska logika",
    "title": "Igralna kocka in nasprotne ploskve",
    "prompt": "Na standardni igralni kocki je vsota pik na nasprotnih ploskvah vedno 7.\n\nNa treh trenutno vidnih ploskvah kocke so številke 2, 4 in 6. Kolikšna je vsota številk na treh skritih (nasprotnih) ploskvah?",
    "type": "text_input",
    "answers": ["9", "devet"],
    "hints": [
      "Nasprotna ploskev številke 2 je 7 – 2 = 5.",
      "Nasprotni ploskvi 4 in 6 sta 3 in 1.",
      "Seštej skrita števila: 5 + 3 + 1 = 9."
    ],
    "explanation": "Nasprotne ploskve so: do 2 je 5, do 4 je 3, do 6 pa 1. Vsota skritih ploskev je 5 + 3 + 1 = 9."
  },
  {
    "id": "puz-1-2-2",
    "category": "logika",
    "subtype": "1.2",
    "categoryTitle": "Logične in analitične uganke",
    "subtypeTitle": "Prostorska logika",
    "title": "Rezanje večdimenzionalne kocke",
    "prompt": "Veliko leseno kocko 4 × 4×4 na vseh zunanjih ploskvah pobarvamo z rdečo barvo. Kocko nato razžagamo na 64 enakih manjših kockic (1 × 1×1).\n\nKoliko od teh 64 kockic ima natanko DVE ploskvi pobarvani z rdečo barvo?",
    "type": "text_input",
    "answers": ["24", "štiriindvajset", "24 kockic"],
    "hints": [
      "Kockice z 2 pobarvanima ploskvama se nahajajo na robovih kocke (brez vogalov).",
      "Kocka ima 12 robov.",
      "Na vsakem robu dolžine 4 sta natanko 2 sredinski kockici z 2 pobarvanima ploskvama: 12 × 2 = ?"
    ],
    "explanation": "Kockice z dvo-ploskovno barvo ležijo na robovih kocke, stran od 8 vogalov. Kocka ima 12 robov, na vsakem robu 4-2=2 kockici. Skupaj: 12 × 2 = 24 kockic."
  },
  {
    "id": "puz-1-2-3",
    "category": "logika",
    "subtype": "1.2",
    "categoryTitle": "Logične in analitične uganke",
    "subtypeTitle": "Prostorska logika",
    "title": "Nepobarvano jedro kocke 5 × 5x5",
    "prompt": "Kocko velikosti 5 × 5×5 zunaj v celoti pobarvamo z modro barvo ter nato razrežemo na 125 manjših kockic 1 × 1×1.\n\nKoliko od teh 125 kockic nima NITI ENE ploskve pobarvane z modro barvo?",
    "type": "text_input",
    "answers": ["27", "sedemindvajset"],
    "hints": [
      "Nepobarvane kocke tvorijo notranje tridimenzionalno jedro.",
      "Od vsake dimenzije (5) odštejemo 2 zunanji obarvani plasti: 5 – 2 = 3.",
      "Prostornina notranjega neobarvanega jedra je 3 × 3 × 3 = ?"
    ],
    "explanation": "Neobarvane kockice ležijo v samem jedru kocke. Dimenzija jedra je (5-2)×(5-2)×(5-2) = 3 × 3×3 = 27 kockic."
  },
  {
    "id": "puz-1-3-1",
    "category": "logika",
    "subtype": "1.3",
    "categoryTitle": "Logične in analitične uganke",
    "subtypeTitle": "Sistemske in pravilniške uganke",
    "title": "Digitalni koren zaporedja",
    "prompt": "Opazuj transformacije števil:\n18 → 9\n49 → 4\n88 → 7\n96 → 6\n\nKatero število po ISTEM pravilu dobimo iz števila 99?",
    "type": "text_input",
    "answers": ["9", "devet"],
    "hints": [
      "Poskusi sešteti števke števila.",
      "Pri 88: 8 + 8 = 16 → ponovno seštej 1 + 6 = 7.",
      "Pri 99: 9 + 9 = 18 → ponovno seštej 1 + 8 = ?"
    ],
    "explanation": "Pravilo je iterativno seštevanje števk (digitalni koren): 99 → 9 + 9 = 18 → 1 + 8 = 9."
  },
  {
    "id": "puz-1-3-2",
    "category": "logika",
    "subtype": "1.3",
    "categoryTitle": "Logične in analitične uganke",
    "subtypeTitle": "Sistemske in pravilniške uganke",
    "title": "Tehtanje med 9 kroglami",
    "prompt": "Imamo 9 na videz popolnoma enakih kroglic, vendar je ena izmed njih nekoliko TEŽJA od preostalih 8.\nNa voljo imamo dvokrakovano tehtnico brez uteži.\n\nKoliko je NAJMANJŠE število tehtanj, s katerimi z 100 % gotovostjo ugotovimo, katera kroglica je težja?",
    "type": "text_input",
    "answers": ["2", "dve", "2 tehtanji"],
    "hints": [
      "Kroglice razdeli na 3 enake skupine po 3 kroglice (3, 3, 3).",
      "V 1. tehtanju na tehtnico postaviš dve skupini po 3 kroglice. Če sta v ravnovesju, je težja v tretji skupini.",
      "Iz izbrane skupine 3 kroglic v 2. tehtanju primerjaš 2 kroglici. Če sta v ravnovesju, je težja preostala tretja!"
    ],
    "explanation": "Z razdelitvijo na skupine 3+3+3 v prvem tehtanju izločimo 6 kroglic in ugotovimo skupino s težjo kroglico. V drugem tehtanju med preostalimi 3 kroglicami z enim tehtanjem določimo težjo. Potrebujemo natanko 2 tehtanji."
  },
  {
    "id": "puz-1-3-3",
    "category": "logika",
    "subtype": "1.3",
    "categoryTitle": "Logične in analitične uganke",
    "subtypeTitle": "Sistemske in pravilniške uganke",
    "title": "Stikala in žarnice v kleti",
    "prompt": "V pritličju so 3 stikala (1, 2, 3), v kleti pa 3 klasične žarnice z nitko. Vsako stikalo upravlja natanko eno žarnico. Iz pritličja se lahko v klet spustiš le ENKRAT.\n\nKako po vrsti uporabiš stikala v pritličju, da po le enem obisku kleti z 100 % gotovostjo določiš, katero stikalo pripada kateri žarnici?",